{
  "$schema": "https://json-schema.org/draft/2020-12/schema",
  "title": "tl-orchestrator Review Result",
  "type": "object",
  "additionalProperties": false,
  "required": [
    "schema_version",
    "verdict",
    "action_items",
    "deferred",
    "rejected"
  ],
  "properties": {
    "schema_version": {
      "const": 1
    },
    "verdict": {
      "enum": [
        "approved",
        "changes_requested"
      ]
    },
    "action_items": {
      "type": "array",
      "items": {
        "$ref": "#/$defs/action_item"
      }
    },
    "deferred": {
      "type": "array",
      "items": {
        "$ref": "#/$defs/finding"
      }
    },
    "rejected": {
      "type": "array",
      "items": {
        "$ref": "#/$defs/finding"
      }
    }
  },
  "$defs": {
    "action_item": {
      "type": "object",
      "additionalProperties": false,
      "required": [
        "id",
        "severity",
        "category",
        "target_role",
        "location",
        "problem",
        "evidence",
        "required_action"
      ],
      "properties": {
        "id": {
          "type": "string",
          "pattern": "^R[1-9][0-9]*$"
        },
        "severity": {
          "enum": [
            "critical",
            "high",
            "medium",
            "low"
          ]
        },
        "category": {
          "enum": [
            "patch",
            "bad_spec",
            "intent_gap"
          ]
        },
        "target_role": {
          "enum": [
            "maker",
            "planner",
            "human"
          ]
        },
        "location": {
          "type": "string",
          "minLength": 1
        },
        "problem": {
          "type": "string",
          "minLength": 1
        },
        "evidence": {
          "type": "string",
          "minLength": 1
        },
        "required_action": {
          "type": "string",
          "minLength": 1
        },
        "scope_status": {
          "type": "string",
          "enum": [
            "inside_parent_envelope",
            "outside_parent_envelope",
            "unprovable"
          ],
          "description": "T032 §2.5: optional Checker declaration about where this item's locations fall relative to the Story Authority envelope. The declaration is necessary but never sufficient: the runtime recomputes the status from the item's locations against the envelope and hard-stops when the two disagree."
        },
        "spec_status": {
          "type": "string",
          "enum": [
            "unchanged",
            "changed"
          ],
          "description": "T032 §2.5: optional Checker declaration about whether resolving this item requires touching the authorized specification. Recomputed and cross-checked by the runtime exactly like scope_status."
        },
        "derivation_blockers": {
          "type": "array",
          "uniqueItems": true,
          "items": {
            "type": "string",
            "enum": [
              "bad_spec",
              "intent_gap",
              "human",
              "security",
              "scope_expansion",
              "new_boundary",
              "migration",
              "capability_expansion"
            ]
          },
          "description": "T032 §2.5: reasons this item cannot be resolved by an automatically derived patch-only child batch. Any entry stops AUTO_STORY and returns the Story to the operator."
        }
      }
    },
    "finding": {
      "type": "object",
      "additionalProperties": false,
      "required": [
        "summary",
        "evidence"
      ],
      "properties": {
        "summary": {
          "type": "string",
          "minLength": 1
        },
        "evidence": {
          "type": "string",
          "minLength": 1
        },
        "location": {
          "type": "string"
        },
        "severity": {
          "enum": [
            "critical",
            "high",
            "medium",
            "low"
          ]
        }
      }
    }
  },
  "allOf": [
    {
      "if": {
        "properties": {
          "verdict": {
            "const": "approved"
          }
        }
      },
      "then": {
        "properties": {
          "action_items": {
            "maxItems": 0
          }
        }
      }
    },
    {
      "if": {
        "properties": {
          "verdict": {
            "const": "changes_requested"
          }
        }
      },
      "then": {
        "properties": {
          "action_items": {
            "minItems": 1
          }
        }
      }
    }
  ]
}
